review_id,rating,comment
1,5,这款手机拍照效果惊艳 夜景模式特别清晰 系统流畅度也很高
2,5,物流速度很快 包装完好无损 手机外观设计时尚大气
3,4,屏幕显示效果很好 色彩还原度不错 但是电池续航一般
4,5,用了两周了 性能非常强劲 打游戏一点都不卡 散热也做得很好
5,3,外观好看但是系统广告太多了 希望能优化一下用户体验
6,4,价格实惠性价比高 功能齐全 适合日常使用
7,5,客服态度很好 有问题及时解决了 产品质量也很棒
8,2,刚买一个月就出现闪退问题 售后处理速度太慢了
9,5,充电速度飞快 二十分钟就能充到百分之八十 太方便了
10,4,手感很好重量适中 但是指纹识别有时候不灵敏
11,5,送给父母的 操作简单易上手 他们很喜欢 字体可以调大很人性化
12,3,音质表现一般般 外放声音不够大 但耳机音质还不错
13,5,等了很久终于抢到了 果然没让我失望 做工精致堪比旗舰
14,4,系统更新很及时 安全性不错 但偶尔会有卡顿现象
15,5,这款产品的生态系统很完善 设备间互联互通体验极佳
16,2,用了三个月电池就严重衰减 一天要充两次电 非常失望
17,5,拍照算法很智能 人像模式虚化自然 直出照片就能发朋友圈
18,4,屏幕刷新率很高 滑动丝般顺滑 但阳光下可视性还需改进
19,5,性价比之王名副其实 这个价位能有这样的配置太香了
20,3,预装软件太多了 占了不少存储空间 还需要自己一个个卸载
21,5,全面屏设计视觉效果很震撼 看视频打游戏沉浸感十足
22,4,手写笔体验不错 延迟很低 适合记笔记和绘画创作
23,5,防水等级很高 下雨天也不怕 户外使用很放心
24,2,屏幕出现了一条绿线 去售后检测说是人为损坏 明明没有摔过
25,5,人脸识别速度极快 戴口罩也能解锁 非常智能方便
26,4,外放音效立体感强 低音有力度 但最大音量时有轻微破音
27,5,折叠屏设计确实惊艳 展开后像个小平板 办公娱乐两不误
28,3,性价比不错但做工细节处理不够好 边框有轻微缝隙
29,5,用了半年依然很流畅 不像安卓手机用久了会卡顿 系统优化做得好
30,4,屏幕护眼模式很舒适 长时间使用眼睛不累 但色温偏暖
31,5,售后服务非常贴心 工作人员上门取件维修 省时省力
32,2,新手机发热严重 看视频都能到四十度 不知道夏天怎么办
33,5,拍照防抖效果好 边走边拍视频画面稳定 堪比运动相机
34,4,电池容量大 正常使用两天一充 轻度用户可以用三天
35,5,机身轻薄但性能不俗 真正做到了轻薄与性能的平衡
36,3,外放音量偏小 在嘈杂环境听不太清 希望下一代能改进
37,5,系统自带的健康管理功能很实用 能提醒注意用眼休息
38,4,游戏性能释放充分 王者荣耀全程满帧运行 散热风扇稍响
39,5,颜值确实高 拿出去朋友都问是什么手机 回头率满满
40,2,买回来发现屏幕有坏点 联系客服说是正常范围不给换 体验很差
41,5,拍照色彩还原非常真实 不像有些手机过度美化 这点很赞
42,4,信号接收能力不错 电梯里也能打电话 比之前的手机好
43,5,快充技术真的改变生活 早上洗漱的功夫就充满电了
44,3,后盖是塑料材质手感还行 要是玻璃材质就更好了
45,5,系统动画流畅自然 过渡效果做的很用心 使用起来赏心悦目
46,4,双扬声器效果震撼 看战争片枪声有身临其境的感觉
47,5,这款产品的AI功能很强大 拍照识物翻译样样在行
48,2,系统bug有点多 升级后就再也连不上蓝牙耳机了 非常恼火
49,5,整体做工水准很高 细节处理到位 完全可以媲美万元旗舰
50,4,屏幕峰值亮度很高 户外强光下也能看清 导航很方便
51,5,儿童模式设计得非常好 可以控制使用时长和应用范围 家长放心
52,3,摄像头凸起太明显 不带壳根本放不平 设计可以更合理一些
53,5,用了两年了还在流畅使用 品质确实过硬 下次还买这个品牌
54,4,系统功能丰富但学习成本略高 老人使用需要一定时间适应
55,5,无线充电速度也很快 配合无线充电板使用非常方便
